setTag,title,authors,datePublished,language,journalName
COVID-19,Mesenchymal Stem Cell Infusion Shows Promise for Combating Coronavirus (COVID-19)- Induced Pneumonia.,"Shetty, Ashok K.",2020-03-01,English,Aging & Disease
COVID-19,"Initial public health response and interim clinical guidance for the 2019 novel coronavirus outbreak — United States, December 31, 2019–February 4, 2020.","Patel, Anita. Jernigan, Daniel B.. Abdirizak, Fatuma. Abedi, Glen. Aggarwal, Sharad. Albina, Denise. Allen, Elizabeth. Andersen, Lauren. Anderson, Jade. Anderson, Megan. Anderson, Tara. Anderson, Kayla. Bardossy, Ana Cecilia. Barry, Vaughn. Beer, Karlyn. Bell, Michael. Berger, Sherri. Bertulfo, Joseph. Biggs, Holly. Bornemann, Jennifer",2020-03-01,English,American Journal of Transplantation
COVID-19,Eco-Virological Preliminary Study of Potentially Emerging Pathogens in Hedgehogs (Erinaceus europaeus) Recovered at a Wildlife Treatment and Rehabilitation Center in Northern Italy.,"Delogu, Mauro. Cotti, Claudia. Lelli, Davide. Sozzi, Enrica. Trogu, Tiziana. Lavazza, Antonio. Garuti, Giacomo. Castrucci, Maria Rita. Vaccari, Gabriele. De Marco, Maria Alessandra. Moreno, Ana",2020-03-01,English,Animals (2076-2615)
COVID-19,Aspects médico-psychologiques relatifs à l'épidémie de coronavirus (Covid-19) : l'apport de la théorie de la détection du signal et du concept de lieu de contrôle.,"Naviaux, Anne-Frédérique. Janne, Pascal. Gourdin, Maximilien",2020-03-01,English,Annales Medico Psychologiques
COVID-19,Preprints: What is their role in medical journals?,Kyu Jin Chung,2020-03-01,English,Archives of Plastic Surgery
COVID-19,Importance Message From the Chief Nursing Officer.,,2020-03-01,English,Arkansas Nursing News
COVID-19,THE COVID-19 PANIC - ANOTHER PREVIEW OF HOW NATIONS CAN BE DISRUPTED.,"BERGMANN, KYM",2020-03-01,English,Asia-Pacific Defence Reporter
COVID-19,Scents and sensibility.,"Chahal, Jeevyn K.",2020-03-01,English,British Columbia Medical Journal
COVID-19,In the line of fire: COVID-19.,"Mendes, Aysha",2020-03-01,English,British Journal of Cardiac Nursing
COVID-19,Data sharing for novel coronavirus (COVID-19).,"Moorthy, Vasee. Henao Restrepo, Ana Maria. Preziosi, Marie-Pierre. Swaminathan, Soumya",2020-03-01,English,Bulletin of the World Health Organization
COVID-19,Novel coronavirus response.,,2020-03-01,English,Bulletin of the World Health Organization
COVID-19,Preliminary Recommendations for Lung Surgery during 2019 Novel Coronavirus Disease (COVID-19) Epidemic Period.,Xin LI. Minghui LIU. Qingchun ZHAO. Renwang LIU. Hongbing ZHANG. Ming DONG. Song XU. Honglin ZHAO. Sen WEI. Zuoqing SONG. Gang CHEN. Jun CHEN,2020-03-01,Chinese,Chinese Journal of Lung Cancer
COVID-19,Clinical Management of Lung Cancer Patients during the Outbreak of 2019 Novel Coronavirus Disease (COVID-19).,Yan XU. Hongsheng LIU. Ke HU. Mengzhao WANG,2020-03-01,Chinese,Chinese Journal of Lung Cancer
COVID-19,积极心态抗击疫情.,陆林,2020-03-01,Chinese,Chinese Mental Health Journal / Zhongguo Xinli Weisheng Zazhi
COVID-19,新冠肺炎流行期 社会心理响应建议.,唐登华,2020-03-01,Chinese,Chinese Mental Health Journal / Zhongguo Xinli Weisheng Zazhi
COVID-19,关爱抗疫前线医务人员的 心理健康刻不容缓.,陆林,2020-03-01,Chinese,Chinese Mental Health Journal / Zhongguo Xinli Weisheng Zazhi
COVID-19,心理危机干预基本要领.,丛中,2020-03-01,Chinese,Chinese Mental Health Journal / Zhongguo Xinli Weisheng Zazhi
COVID-19,一线工作人员的心理问题.,高兵玲. 唐登华. 周书喆,2020-03-01,Chinese,Chinese Mental Health Journal / Zhongguo Xinli Weisheng Zazhi
COVID-19,新冠肺炎患者的 常见心理冲突及应对策略.,周书喆. 黄薛冰. 钱英. 高兵玲. 唐登华,2020-03-01,Chinese,Chinese Mental Health Journal / Zhongguo Xinli Weisheng Zazhi
COVID-19,新冠肺炎疑似患者的 心理自助.,黄韩宇. 陈超. 司天梅,2020-03-01,Chinese,Chinese Mental Health Journal / Zhongguo Xinli Weisheng Zazhi
COVID-19,新冠肺炎流行期 精神卫生问题患者心理自助建议.,石扩. 马燕桃. 孔庆梅. 闫俊. 李冰. 李雪霓. 梁英. 程嘉. 马宁,2020-03-01,Chinese,Chinese Mental Health Journal / Zhongguo Xinli Weisheng Zazhi
COVID-19,新冠肺炎流行期老年人的 常见心理反应及应对策略.,蒲城城. 王华丽,2020-03-01,Chinese,Chinese Mental Health Journal / Zhongguo Xinli Weisheng Zazhi
COVID-19,新冠肺炎流行期 孕产妇的心理应对.,何萤萤,2020-03-01,Chinese,Chinese Mental Health Journal / Zhongguo Xinli Weisheng Zazhi
COVID-19,新冠肺炎流行期如何保护自己和孩子.,林红,2020-03-01,Chinese,Chinese Mental Health Journal / Zhongguo Xinli Weisheng Zazhi
COVID-19,新冠肺炎流行期家长如何应对孩子假期延长.,敦癑. 李雪. 刘靖. 曹庆久,2020-03-01,Chinese,Chinese Mental Health Journal / Zhongguo Xinli Weisheng Zazhi
COVID-19,新冠肺炎流行期精神障碍儿童居家护理.,王慧. 熊娜娜. 李雪. 李江华. 敦癑. 曹庆久. 刘豫鑫,2020-03-01,Chinese,Chinese Mental Health Journal / Zhongguo Xinli Weisheng Zazhi
COVID-19,有效亲子沟通助力平安度过新冠肺炎流行期.,王慧. 敦癑. 李雪. 郭延庆. 刘靖,2020-03-01,Chinese,Chinese Mental Health Journal / Zhongguo Xinli Weisheng Zazhi
COVID-19,新冠肺炎流行期 焦虑症状的自我缓解.,黄悦勤,2020-03-01,Chinese,Chinese Mental Health Journal / Zhongguo Xinli Weisheng Zazhi
COVID-19,新冠肺炎流行期 个体如何克服恐慌.,于欣,2020-03-01,Chinese,Chinese Mental Health Journal / Zhongguo Xinli Weisheng Zazhi
COVID-19,新型冠状病毒肺炎智慧应对四箴言.,钱英. 马宁,2020-03-01,Chinese,Chinese Mental Health Journal / Zhongguo Xinli Weisheng Zazhi
COVID-19,新冠肺炎流行期 针对大众心理健康的建议.,常蕾. 黄薛冰. 赵梦婕. 马宁. 孙伟. 师乐. 范滕滕,2020-03-01,Chinese,Chinese Mental Health Journal / Zhongguo Xinli Weisheng Zazhi
COVID-19,心理危机的自助方法.,钱英. 胡思帆. 孙洪强,2020-03-01,Chinese,Chinese Mental Health Journal / Zhongguo Xinli Weisheng Zazhi
COVID-19,新冠肺炎流行期 心理自助方法详解.,石川. 钱英. 李雪. 李雪霓. 杨磊. 刘琦. 潘成英. 孙新宇. 黄薛冰. 柳学华. 姜思思. 马湘云. 孙伟. 徐建芳. 邢颖. 王天姿. 廖金敏. 周书喆. 何萤萤. 井军君,2020-03-01,Chinese,Chinese Mental Health Journal / Zhongguo Xinli Weisheng Zazhi
COVID-19,精神卫生工作者共抗疫情.,王向群,2020-03-01,Chinese,Chinese Mental Health Journal / Zhongguo Xinli Weisheng Zazhi
COVID-19,Sharing Our Experience of Operating an Endoscopy Unit in the Midst of a COVID-19 Outbreak.,Jimin Han. Eun Young Kim,2020-03-01,English,Clinical Endoscopy
COVID-19,"Think national, act local: the role of the physician and the RCP.","Emmanuel, Anton",2020-03-01,English,Clinical Medicine
COVID-19,Soluble angiotensin-converting enzyme 2: a potential approach for coronavirus infection therapy?,"Batlle, Daniel. Wysocki, Jan. Satchell, Karla",2020-03-01,English,Clinical Science
COVID-19,The authors reply.,"Vincent, Jean-Louis. Santacruz, Carlos A.",2020-03-01,English,Critical Care Medicine
COVID-19,Staff Mental Health Self-Assessment During the COVID-19 Outbreak.,"Chung, Joseph P. Y.. Wai-song Yeung",2020-03-01,English,East Asian Archives of Psychiatry
COVID-19,MODELING THE CONTROL OF COVID-19: IMPACT OF POLICY INTERVENTIONS AND METEOROLOGICAL FACTORS.,JIWEI JIA. JIAN DING. SIYU LIU. GUIDONG LIAO. JINGZHI LI. BEN DUAN. GUOQING WANG. RAN ZHANG,2020-03-01,English,Electronic Journal of Differential Equations
COVID-19,The novel Chinese coronavirus (2019‐nCoV) infections: Challenges for fighting the storm.,"Bassetti, Matteo. Vena, Antonio. Giacobbe, Daniele Roberto",2020-03-01,English,European Journal of Clinical Investigation
COVID-19,Challenges and responsibilities of family doctors in the new global coronavirus outbreak.,"Kwok Tung Li, Donald",2020-03-01,English,Family Medicine & Community Health
COVID-19,Editorial.,"Barrett, Steve",2020-03-01,English,Fuel Cells Bulletin
COVID-19,About coronavirus.,"Wakefield, Benjamin",2020-03-01,English,Gastrointestinal Nursing
COVID-19,SARS-CoV-2 in Romania - situation update and containment strategies.,"Streinu-Cercel, Adrian",2020-03-01,English,Germs
COVID-19,Panic of Buying Toilet Papers: A Historical Memory or a Horrible Truth? Systematic Review of Gastrointestinal Manifestations of COVID-19.,"Miri, Seyyed Mohammad. Roozbeh, Fatemeh. Omranirad, Ali. Alavian, Seyed Moayed",2020-03-01,English,Hepatitis Monthly
COVID-19,The 2019 novel corona virus outbreak – An institutional guideline.,"Suresh, Varun",2020-03-01,English,Indian Journal of Anaesthesia
COVID-19,Emergent Strategies for the Next Phase of COVID-19.,Kyungmin Huh. Hyoung-Shik Shin. Kyong Ran Peck,2020-03-01,English,Infection & Chemotherapy
COVID-19,"COVID-19, A Clinical Syndrome Manifesting as Hypersensitivity Pneumonitis.",Young Goo Song. Hyoung-Shik Shin,2020-03-01,English,Infection & Chemotherapy
COVID-19,2020 year of the nurse and midwife: Meeting new challenges.,"Bell, Sue Anne. Brysiewicz, Petra",2020-03-01,English,International Emergency Nursing
COVID-19,Chloroquine for the 2019 novel coronavirus SARS-CoV-2.,"Colson, Philippe. Rolain, Jean-Marc. Raoult, Didier",2020-03-01,English,International Journal of Antimicrobial Agents
COVID-19,The Battle Against COVID-19: Where Do We Stand Now?,"Negahdaripour, Manica",2020-03-01,English,Iranian Journal of Medical Sciences
COVID-19,Coronaphobia: Fear and the 2019-nCoV outbreak.,"Asmundson, Gordon J.G.. Taylor, Steven",2020-03-01,English,Journal of Anxiety Disorders
COVID-19,Backcalculating the Incidence of Infection with COVID-19 on the Diamond Princess.,"Nishiura, Hiroshi",2020-03-01,English,Journal of Clinical Medicine
COVID-19,Optimization Method for Forecasting Confirmed Cases of COVID-19 in China.,"Al-qaness, Mohammed A. A.. Ewees, Ahmed A.. Fan, Hong. Abd El Aziz, Mohamed",2020-03-01,English,Journal of Clinical Medicine
COVID-19,"Prediction of the Epidemic Peak of Coronavirus Disease in Japan, 2020.","Kuniya, Toshikazu",2020-03-01,English,Journal of Clinical Medicine
COVID-19,Smoking Upregulates Angiotensin-Converting Enzyme-2 Receptor: A Potential Adhesion Site for Novel Coronavirus SARS-CoV-2 (Covid-19).,"Brake, Samuel James. Barnsley, Kathryn. Lu, Wenying. McAlinden, Kielan Darcy. Eapen, Mathew Suji. Sohal, Sukhwinder Singh",2020-03-01,English,Journal of Clinical Medicine
COVID-19,"Fear, explanation and action – the psychosocial response to emerging infections.","Loveday, Heather",2020-03-01,English,Journal of Infection Prevention
COVID-19,COVID-19 and the vulnerability of kidney patients.,"Palmer, Nicholas",2020-03-01,English,Journal of Kidney Care
COVID-19,The Role of Augmented Intelligence (AI) in Detecting and Preventing the Spread of Novel Coronavirus.,"Long, Justin B.. Ehrenfeld, Jesse M.",2020-03-01,English,Journal of Medical Systems
COVID-19,新型冠状病毒肺炎疫情期间器械相关压力性损伤的防治策略建议.,张运昌. 盛春泉. 王柄凯. 马志强. 杨　峰,2020-03-01,Chinese,Journal of Pharmaceutical Practice
COVID-19,新冠肺炎患者救治及康复中的中药治疗思考.,尤本明. 王忠壮,2020-03-01,Chinese,Journal of Pharmaceutical Practice
COVID-19,At the heart of the mission of general practice.,"Dovey, Susan M.",2020-03-01,English,Journal of Primary Health Care
COVID-19,Coronavirus (COVID-19): infection control and prevention measures.,"Jordan, Vanessa",2020-03-01,English,Journal of Primary Health Care
COVID-19,First case of Coronavirus Disease 2019 (COVID-19) pneumonia in Taiwan.,"Cheng, Shao-Chung. Chang, Yuan-Chia. Fan Chiang, Yu-Long. Chien, Yu-Chan. Cheng, Mingte. Yang, Chin-Hua. Huang, Chia-Husn. Hsu, Yuan-Nian",2020-03-01,English,Journal of the Formosan Medical Association
COVID-19,Modified SEIR and AI prediction of the epidemics trend of COVID-19 in China under public health interventions.,Zifeng Yang. Zhiqi Zeng. Ke Wang. Sook-San Wong. Wenhua Liang. Mark Zanin. Peng Liu. Xudong Cao. Zhongqiang Gao. Zhitong Mai. Jingyi Liang. Xiaoqing Liu. Shiyue Li. Yimin Li. Feng Ye. Weijie Guan. Yifan Yang. Fei Li. Shengmei Luo. Yuqi Xie,2020-03-01,English,Journal of Thoracic Disease
COVID-19,The reproductive number of COVID-19 is higher compared to SARS coronavirus.,"Liu, Ying. Gayle, Albert A. Wilder-Smith, Annelies. Rocklöv, Joacim",2020-03-01,English,Journal of Travel Medicine
COVID-19,"Isolation, quarantine, social distancing and community containment: pivotal role for old-style public health measures in the novel coronavirus (2019-nCoV) outbreak.","Wilder-Smith, A. Freedman, D O",2020-03-01,English,Journal of Travel Medicine
COVID-19,Travellers give wings to novel coronavirus (2019-nCoV).,"Wilson, Mary E. Chen, Lin H",2020-03-01,English,Journal of Travel Medicine
COVID-19,"Quantifying the association between domestic travel and the exportation of novel coronavirus (2019-nCoV) cases from Wuhan, China in 2020: a correlational analysis.","Zhao, Shi. Zhuang, Zian. Cao, Peihua. Ran, Jinjun. Gao, Daozhou. Lou, Yijun. Yang, Lin. Cai, Yongli. Wang, Weiming. He, Daihai. Wang, Maggie H",2020-03-01,English,Journal of Travel Medicine
COVID-19,The kaiwhakahaere comments:.,"Nuku, Kerri",2020-03-01,English,Kai Tiaki Nursing New Zealand
COVID-19,Nurses under pressure as COVID-19 looms.,,2020-03-01,English,Kai Tiaki Nursing New Zealand
COVID-19,Challenges of coronavirus disease 2019.,The Lancet Infectious Diseases,2020-03-01,English,Lancet Infectious Diseases
COVID-19,Game consumption and the 2019 novel coronavirus.,"Li, Jie. Li, Jun (Justin). Xie, Xiaoru. Cai, Xiaomei. Huang, Jian. Tian, Xuemei. Zhu, Hong. Li, Jun",2020-03-01,English,Lancet Infectious Diseases
COVID-19,Pandemic potential of 2019-nCoV.,"Thompson, Robin",2020-03-01,English,Lancet Infectious Diseases
COVID-19,Outbreak of coronavirus disease 2019.,"Burki, Talha",2020-03-01,English,Lancet Infectious Diseases
COVID-19,Cancer patients in SARS-CoV-2 infection: a nationwide analysis in China.,"Liang, Wenhua. Guan, Weijie. Chen, Ruchong. Wang, Wei. Li, Jianfu. Xu, Ke. Li, Caichen. Ai, Qing. Lu, Weixiang. Liang, Hengrui. Li, Shiyue. He, Jianxing",2020-03-01,English,Lancet Oncology
COVID-19,Hepatitis and Novel Wuhan Coronavirus Infection: Observation.,"Sookaromdee, Pathum. Wiwanitkit, Viroj",2020-03-01,English,Medical Journal of Dr. D.Y. Patil University
COVID-19,Novel Coronavirus: Concern over health-care professionals.,"Banu, Nilofur",2020-03-01,English,Medical Journal of Dr. D.Y. Patil University
COVID-19,Support for health-care professionals during Wuhan Coronavirus infection outbreak.,"Wiwanitkit, Viroj",2020-03-01,English,Medical Journal of Dr. D.Y. Patil University
COVID-19,Pathogenicity and transmissibility of 2019-nCoV—A quick overview and comparison with other emerging viruses.,"Chen, Jieliang",2020-03-01,English,Microbes & Infection
COVID-19,Is COVID-19 receiving ADE from other coronaviruses?,"Tetro, Jason A.",2020-03-01,English,Microbes & Infection
COVID-19,"Measures for diagnosing and treating infections by a novel coronavirus responsible for a pneumonia outbreak originating in Wuhan, China.","Yu, Fei. Du, Lanying. Ojcius, David M.. Pan, Chungen. Jiang, Shibo",2020-03-01,English,Microbes & Infection
COVID-19,The epidemic of 2019-novel-coronavirus (2019-nCoV) pneumonia and insights for emerging infectious diseases in the future.,"Li, Jin-Yan. You, Zhi. Wang, Qiong. Zhou, Zhi-Jian. Qiu, Ye. Luo, Rui. Ge, Xing-Yi",2020-03-01,English,Microbes & Infection
COVID-19,Lessons learned from the 2019-nCoV epidemic on prevention of future infectious diseases.,"Pan, Xingchen. Ojcius, David M.. Gao, Tianyue. Li, Zhongsheng. Pan, Chunhua. Pan, Chungen",2020-03-01,English,Microbes & Infection
COVID-19,"Coronavirus (COVID-19) Update: FDA and CDC take action to increase access to respirators, including N95s, for health care personnel.","Goldstein, Mitchell",2020-03-01,English,Neonatology Today
COVID-19,Transcript - CDC Media Telebriefing: Update on COVID-19.,"Goldstein, Mitchell",2020-03-01,English,Neonatology Today
COVID-19,American College of Surgeons offers triage guidance for non-emergent surgical procedures during the COVID-19 outbreak.,"Goldstein, Mitchell",2020-03-01,English,Neonatology Today
COVID-19,Chinese case study suggests COVID-19 is not transmitted from pregnant mothers to newborns.,"Goldstein, Mitchell",2020-03-01,English,Neonatology Today
COVID-19,Extraordinary times: COVID-19 pandemic.,,2020-03-01,English,Nursing Praxis in New Zealand
COVID-19,Coronavirus action plan: a guide to what you can expect across the UK.,,2020-03-01,English,Operating Theatre Journal
COVID-19,Coronavirus disease 2019 on everyone's mind.,"Hennessy Sr., Mike",2020-03-01,English,Optometry Times
COVID-19,'Dental Hierarchy of Needs' in the COVID-19 Era - or Why Treat When It Doesn't Hurt?,"Levin, Liran",2020-03-01,English,Oral Health & Preventive Dentistry
COVID-19,Expanded Umbilical Cord Mesenchymal Stem Cells (UC-MSCs) as a Therapeutic Strategy in Managing Critically Ill COVID-19 Patients: The Case for Compassionate Use.,"Atluri, Sairam. Manchikanti, Laxmaiah. Hirsch, Joshua A.",2020-03-01,English,Pain Physician
COVID-19,Global Spread of Coronavirus: Preparing Health Care Workers.,"Cataletto, Mary",2020-03-01,English,"Pediatric Allergy, Immunology & Pulmonology"
COVID-19,The Coronavirus Disease 2019 (COVID-19).,"Hageman, Joseph R.",2020-03-01,English,Pediatric Annals
COVID-19,ХАРАКТЕРИСТИКИ SARS-COV-2 ИНФЕКЦИИ У ПЕДИАТРИЧЕСКИХ ПАЦИЕНТОВ И ВОЗМОЖНЫЕ ДОКАЗАТЕЛЬСТВА ПЕРСИСТИРУЮЩЕГО ВЫДЕЛЕНИЯ ВИРУСОВ С ФЕКАЛИЯМИ,,2020-03-01,Russian,Pediatriya named after G. N. Speransky
COVID-19,КОРОНАВИРУСНАЯ ИНФЕКЦИЯ У ДЕТЕЙ.,"Зверева, Н. Н.. Сайфуллин, М. А.. Ртищев, А. Ю.. Шамшева, О. В.. Пшеничная, Н. Ю.",2020-03-01,Russian,Pediatriya named after G. N. Speransky
COVID-19,"Emetine, Ipecac, Ipecac Alkaloids and Analogues as Potential Antiviral Agents for Coronaviruses.","Bleasel, Martin D.. Peterson, Gregory M.",2020-03-01,English,Pharmaceuticals (14248247)
COVID-19,Coronavirus round-up.,,2020-03-01,English,Practice Nurse
COVID-19,We've Come a Long Way... Or Have We?,"Hennessy Sr, Mike",2020-03-01,English,Psychiatric Times
COVID-19,"The New Game of Microbiology Clue: The Who, When, Where, & Why of the Novel Coronavirus.","Moukaddam, Nidal. Shah, Asim",2020-03-01,English,Psychiatric Times
COVID-19,Psychiatrists Beware! The Impact of COVID-19 and Pandemics on Mental Health.,"Moukaddam, Nidal. Shah, Asim",2020-03-01,English,Psychiatric Times
COVID-19,"Urgent need for individual mobile phone and institutional reporting of at home, hospitalized, and intensive care unit cases of SARS-CoV-2 (COVID-19) infection.","McCullough, Peter A.. Eidt, John. Rangaswami, Janani. Lerma, Edgar. Tumlin, James. Wheelan, Kevin. Katz, Nevin. Lepor, Norman E.. Vijay, Kris. Soman, Sandeep. Singh, Bhupinder. McCullough, Sean P.. McCullough, Haley B.. Palazzuoli, Alberto. Ruocco, Gaetano M.. Ronco, Claudio",2020-03-01,English,Reviews in Cardiovascular Medicine
COVID-19,"Infecciones emergentes, el gran reto de la salud global: Covid-19.","Alpuche-Aranda, Celia M.",2020-03-01,Spanish,Salud Pública de México
COVID-19,Covid-19: la nueva enfermedad causada por un coronavirus.,"Ramos, Celso",2020-03-01,Spanish,Salud Pública de México
COVID-19,Novel Wuhan Coronavirus: What's the Real Story?,"REED, WILLIAM",2020-03-01,English,Science Teacher
COVID-19,"Novel coronavirus 2019, an emerging public health emergency.","Ward, Michael P.. Li, Xiangdong. Tian, Kegong",2020-03-01,English,Transboundary & Emerging Diseases
COVID-19,The COVID-19 epidemic.,"Velavan, Thirumalaisamy P.. Meyer, Christian G.",2020-03-01,English,Tropical Medicine & International Health
COVID-19,"What to Do When A Patient Infected With COVID-19 Needs An Operation: A Pre-surgery, Peri-surgery and Post-surgery Guide.","Kamer, Erdinç. Çolak, Tahsin",2020-03-01,English,Turkish Journal of Colorectal Disease
COVID-19,General Surgery Operating Room Practice in Patients with COVID-19.,"Karaca, Ahmet Serdar. Özmen, M. Mahir. Uçar, Ahmet Deniz. Yastı, Ahmet Çınar. Demirer, Seher",2020-03-01,English,Turkish Journal of Surgery (Bilimsel Tip Yayinevi)
COVID-19,COVID-19'lu Hastalarda Genel Cerrahi Ameliyathane Uygulamaları.,"Karaca, Ahmet Serdar. Özmen, M. Mahir. Uçar, Ahmet Deniz. Yastı, Ahmet Çınar. Demirer, Seher",2020-03-01,Turkish,Turkish Journal of Surgery (Bilimsel Tip Yayinevi)
COVID-19,Preliminary Identification of Potential Vaccine Targets for the COVID-19 Coronavirus (SARS-CoV-2) Based on SARS-CoV Immunological Studies.,"Ahmed, Syed Faraz. Quadeer, Ahmed A.. McKay, Matthew R.",2020-03-01,English,Viruses (1999-4915)
COVID-19,2019-nCoV: The Identify-Isolate-Inform (3I) Tool Applied to a Novel Emerging Coronavirus.,"Koenig, Kristi L.. Beÿ, Christian K.. McDonald, Eric C.",2020-03-01,English,Western Journal of Emergency Medicine: Integrating Emergency Care with Population Health
COVID-19,Critical care crisis and some recommendations during the COVID-19 epidemic in China.,Xie J. Tong Z. Guan X. Du B. Qiu H. Slutsky AS,2020-03-02,English,Intensive care medicine
COVID-19,Imaging changes of severe COVID-19 pneumonia in advanced stage.,Zhang W,2020-03-02,English,Intensive care medicine
COVID-19,A Chinese Case of COVID-19 Did Not Show Infectivity During the Incubation Period: Based on an Epidemiological Survey.,Bae JM,2020-03-02,English,Journal of preventive medicine and public health = Yebang Uihakhoe chi
COVID-19,Factors Associated With Mental Health Outcomes Among Health Care Workers Exposed to Coronavirus Disease 2019.,Lai J. Ma S. Wang Y. Cai Z. Hu J. Wei N. Wu J. Du H. Chen T. Li R. Tan H. Kang L. Yao L. Huang M. Wang H. Wang G. Liu Z. Hu S,2020-03-02,English,JAMA network open
COVID-19,Exercising Heart and Head in Managing Coronavirus Disease 2019 in Wuhan.,Perlis RH,2020-03-02,English,JAMA network open
COVID-19,"Possible Transmission of Severe Acute Respiratory Syndrome Coronavirus 2 (SARS-CoV-2) in a Public Bath Center in Huai'an, Jiangsu Province, China.",Luo C. Yao L. Zhang L. Yao M. Chen X. Wang Q. Shen H,2020-03-02,English,JAMA network open
COVID-19,"The novel coronavirus outbreak in Wuhan, China.",Zhu H. Wei L. Niu P,2020-03-02,English,Global health research and policy
COVID-19,First two months of the 2019 Coronavirus Disease (COVID-19) epidemic in China: real-time surveillance and evaluation with a second derivative model.,Chen X. Yu B,2020-03-02,English,Global health research and policy
COVID-19,Learning from the Past: Possible Urgent Prevention and Treatment Options for Severe Acute Respiratory Infections Caused by 2019-nCoV.,Morse JS. Lalonde T. Xu S. Liu WR,2020-03-02,English,Chembiochem : a European journal of chemical biology
COVID-19,[Diagnostic and therapeutic strategies of lung cancer patients during the outbreak of 2019 novel coronavirus disease (COVID-19)].,Yang L. Xu HY. Wang Y,2020-03-02,Chinese,Zhonghua zhong liu za zhi [Chinese journal of oncology]
COVID-19,"[Cause analysis and treatment strategies of ""recurrence"" with novel coronavirus pneumonia (covid-19) patients after discharge from hospital].",Zhou L. Liu K. Liu HG,2020-03-02,Chinese,Zhonghua jie he he hu xi za zhi = Zhonghua jiehe he huxi zazhi = Chinese journal of tuberculosis and respiratory diseases
COVID-19,[Cardiac manifestations of patients with COVID-19 pneumonia and related treatment recommendations].,Tan ZC. Fu LH. Wang DD. Hong K,2020-03-02,Chinese,Zhonghua xin xue guan bing za zhi
COVID-19,[Myocardial injury in patients with COVID-19 pneumonia].,Wei ZY. Qian HY,2020-03-02,Chinese,Zhonghua xin xue guan bing za zhi
COVID-19,[Prevention and control program on 2019 novel coronavirus infection in children's digestive endoscopy center].,,2020-03-02,Chinese,Zhonghua er ke za zhi = Chinese journal of pediatrics
COVID-19,[First case of severe childhood novel coronavirus pneumonia in China].,Chen F. Liu ZS. Zhang FR. Xiong RH. Chen Y. Cheng XF. Wang WY. Ren J,2020-03-02,Chinese,Zhonghua er ke za zhi = Chinese journal of pediatrics
COVID-19,[2019 novel coronavirus infection in a three-month-old baby].,Zhang YH. Lin DJ. Xiao MF. Wang JC. Wei Y. Lei ZX. Zeng ZQ. Li L. Li HA. Xiang W,2020-03-02,Chinese,Zhonghua er ke za zhi = Chinese journal of pediatrics
COVID-19,"Covid-19: retired doctors could be asked to return to work, says Hancock.",Mahase E,2020-03-02,English,BMJ (Clinical research ed.)
COVID-19,"Covid-19: US health department staff sent to meet citizens returning from China weren't protected, claims whistleblower.",Dyer O,2020-03-02,English,BMJ (Clinical research ed.)
COVID-19,Relation Between Chest CT Findings and Clinical Conditions of Coronavirus Disease (COVID-19) Pneumonia: A Multicenter Study.,Zhao W. Zhong Z. Xie X. Yu Q. Liu J,2020-03-03,English,AJR. American journal of roentgenology
COVID-19,The SARS-CoV-2 Vaccine Pipeline: an Overview.,Chen WH. Strych U. Hotez PJ. Bottazzi ME,2020-03-03,English,Current tropical medicine reports
COVID-19,Evidence for gastrointestinal infection of SARS-CoV-2.,Xiao F. Tang M. Zheng X. Liu Y. Li X. Shan H,2020-03-03,English,Gastroenterology
COVID-19,Stepping up infection control measures in ophthalmology during the novel coronavirus outbreak: an experience from Hong Kong.,Lai THT. Tang EWH. Chau SKY. Fung KSC. Li KKW,2020-03-03,English,Graefe's archive for clinical and experimental ophthalmology = Albrecht von Graefes Archiv fur klinische und experimentelle Ophthalmologie
COVID-19,Identification of COVID-19 Can be Quicker through Artificial Intelligence framework using a Mobile Phone-Based Survey in the Populations when Cities/Towns Are Under Quarantine.,Rao ASRS. Vazquez JA,2020-03-03,English,Infection control and hospital epidemiology
