setTag,title,authors,datePublished,language,journalName
COVID-19,COVID-19 Provides An Opportunity to Reassess How Frequent and How Extensive Elective Spine Surgery Should Be.,"Epstein, Nancy E.",2020-03-30,English,Surgical Neurology International
COVID-19,"Coronavirus Disease 19 Infection Does Not Result in Acute Kidney Injury: An Analysis of 116 Hospitalized Patients from Wuhan, China.",Wang L. Li X. Chen H. Yan S. Li D. Li Y. Gong Z,2020-03-31,English,American journal of nephrology
COVID-19,Lest we forget.,Halazun KJ. Rosenblatt R,2020-03-31,English,American journal of transplantation : official journal of the American Society of Transplantation and the American Society of Transplant Surgeons
COVID-19,The Importance of Diagnostic Testing during a Viral Pandemic: Early Lessons from Novel Coronavirus Disease (COVID-19).,Rosenthal PJ,2020-03-31,English,The American journal of tropical medicine and hygiene
COVID-19,Utility of Substandard Face Mask Options for Health Care Workers During the COVID-19 Pandemic.,Abd-Elsayed A. Karri J,2020-03-31,English,Anesthesia and analgesia
COVID-19,Lessons learned from first COVID-19 cases in the United States.,Landau R. Bernstein K. Mhyre J,2020-03-31,English,Anesthesia and analgesia
COVID-19,Coronaviruses and SARS-CoV-2: A Brief Overview.,Ludwig S. Zarbock A,2020-03-31,English,Anesthesia and analgesia
COVID-19,"Waste Not, Want Not: The Re-Usability of N95 Masks.",Nathan N,2020-03-31,English,Anesthesia and analgesia
COVID-19,The Essential Role of Patient Blood Management in a Pandemic: A Call for Action.,Shander A. Goobie SM. Warne MA. Aapro M. Bisbe E. Perez-Calatayud AA. Callum J. Cushing MM. Dyer WB. Erhard J. Faraoni D. Farmer S. Fedorova T. Frank SM. Froessler B. Gombotz H. Gross I. Guinn NR. Haas T. Hamdorf J. Isbister JP. Javidroozi M. Ji H. Kim YW. Kor DJ. Kurz J. Lasocki S. Leahy MF. Lee CK. Lee JJ. Louw V. Meier J. Mezzacasa A. Munoz M. Ozawa S. Pavesi M. Shander N. Spahn DR. Spiess BD. Thomson J. Trentino K. Zenger C. Hofmann A,2020-03-31,English,Anesthesia and analgesia
COVID-19,Annals On Call - Protecting Health Care Workers From COVID-19.,Centor RM. Marrazzo J,2020-03-31,English,Annals of internal medicine
COVID-19,Use of Hydroxychloroquine and Chloroquine During the COVID-19 Pandemic: What Every Clinician Should Know.,Yazdany J. Kim AHJ,2020-03-31,English,Annals of internal medicine
COVID-19,Guidelines for Laboratory Diagnosis of Coronavirus Disease 2019 (COVID-19) in Korea.,Hong KH. Lee SW. Kim TS. Huh HJ. Lee J. Kim SY. Park JS. Kim GJ. Sung H. Roh KH. Kim JS. Kim HS. Lee ST. Seong MW. Ryoo N. Lee H. Kwon KC. Yoo CK,2020-03-31,English,Annals of laboratory medicine
COVID-19,COVID-19 in patients with cardiovascular diseases.,Hulot JS,2020-03-31,English,Archives of cardiovascular diseases
COVID-19,Cancer Labs Pivot to Battle COVID-19.,,2020-03-31,English,Cancer discovery
COVID-19,COVID-19: a new challenge for human beings.,Yang P. Wang X,2020-03-31,English,Cellular & molecular immunology
COVID-19,"Guidance for Cardiac Electrophysiology During the Coronavirus (COVID-19) Pandemic from the Heart Rhythm Society COVID-19 Task Force; Electrophysiology Section of the American College of Cardiology; and the Electrocardiography and Arrhythmias Committee of the Council on Clinical Cardiology, American Heart Association.",Lakkireddy DR. Chung MK. Gopinathannair R. Patton KK. Gluckman TJ. Turagam M. Cheung J. Patel P. Sotomonte J. Lampert R. Han JK. Rajagopalan B. Eckhardt L. Joglar J. Sandau K. Olshansky B. Wan E. Noseworthy PA. Leal M. Kaufman E. Gutierrez A. Marine JM. Wang PJ. Russo AM,2020-03-31,English,Circulation
COVID-19,Disparities in Age-Specific Morbidity and Mortality from SARS-CoV-2 in China and the Republic of Korea.,Dudley JP. Lee NT,2020-03-31,English,Clinical infectious diseases : an official publication of the Infectious Diseases Society of America
COVID-19,Computed Tomographic Imaging of 3 Patients With Coronavirus Disease 2019 Pneumonia With Negative Virus Real-time Reverse-Transcription Polymerase Chain Reaction Test.,Xu J. Wu R. Huang H. Zheng W. Ren X. Wu N. Ji B. Lv Y. Liu Y. Mi R,2020-03-31,English,Clinical infectious diseases : an official publication of the Infectious Diseases Society of America
COVID-19,Triaging Spine Surgery in the COVID-19 Era.,Donnally CJ 3rd. Shenoy K. Vaccaro AR. Schroeder GD. Kepler CK,2020-03-31,English,Clinical spine surgery
COVID-19,Lung ultrasound findings in a 64-year-old woman with COVID-19.,Thomas A. Haljan G. Mitra A,2020-03-31,English,CMAJ : Canadian Medical Association journal = journal de l'Association medicale canadienne
COVID-19,Coronavirus pandemic and Colorectal surgery: practical advice based on the Italian experience.,Di Saverio S. Pata F. Gallo G. Carrano F. Scorza A. Sileri P. Smart N. Spinelli A. Pellino G,2020-03-31,English,Colorectal disease : the official journal of the Association of Coloproctology of Great Britain and Ireland
COVID-19,Diabetes is a risk factor for the progression and prognosis of COVID-19.,Guo W. Li M. Dong Y. Zhou H. Zhang Z. Tian C. Qin R. Wang H. Shen Y. Du K. Zhao L. Fan H. Luo S. Hu D,2020-03-31,English,Diabetes/metabolism research and reviews
COVID-19,Covid-19 and diabetes mellitus: unveiling the interaction of two pandemics.,Maddaloni E. Buzzetti R,2020-03-31,English,Diabetes/metabolism research and reviews
COVID-19,Interventional radiology and COVID-19: evidence-based measures to limit transmission.,Chandy PE. Nasir MU. Srinivasan S. Klass D. Nicolaou S. Babu SB,2020-03-31,English,"Diagnostic and interventional radiology (Ankara, Turkey)"
COVID-19,How imaging should properly be used in COVID-19 outbreak: an Italian experience.,Sverzellati N. Milone F. Balbi M,2020-03-31,English,"Diagnostic and interventional radiology (Ankara, Turkey)"
COVID-19,"Epidemiological characteristics on the clustering nature of COVID-19 in Qingdao City, 2020: a descriptive analysis.",Jia J. Hu X. Yang F. Song X. Dong L. Zhang J. Jiang F. Gao R,2020-03-31,English,Disaster medicine and public health preparedness
COVID-19,Mortality rate of infection with COVID-19 in Korea from the perspective of underlying disease.,Kang YJ,2020-03-31,English,Disaster medicine and public health preparedness
COVID-19,EMA advice on the use of NSAIDs for Covid-19.,,2020-03-31,English,Drug and therapeutics bulletin
COVID-19,COVID-19 disease Emergency Operational Instructions for Mental Health Departments issued by the Italian Society of Epidemiological Psychiatry.,Starace F. Ferrara M,2020-03-31,English,Epidemiology and psychiatric sciences
COVID-19,Initial COVID-19 affecting cardiac patients in China.,Han Y,2020-03-31,English,European heart journal
COVID-19,Recommendations from the Peking Union Medical College Hospital for the management of acute myocardial infarction during the COVID-19 outbreak.,Jing ZC. Zhu HD. Yan XW. Chai WZ. Zhang S,2020-03-31,English,European heart journal
COVID-19,AGA Institute Rapid Recommendations for Gastrointestinal Procedures During the COVID-19 Pandemic.,Sultan S. Lim JK. Altayar O. Davitkov P. Feuerstein JD. Siddique SM. Falck-Ytter Y. El-Serag HB,2020-03-31,English,Gastroenterology
COVID-19,"SARS-CoV-2, COVID-19 and inherited arrhythmia syndromes.",Wu CI. Postema PG. Arbelo E. Behr ER. Bezzina CR. Napolitano C. Robyns T. Probst V. Schulze-Bahr E. Remme CA. Wilde AAM,2020-03-31,English,Heart rhythm
COVID-19,Development of in vitro transcribed RNA as positive control for laboratory diagnosis of SARS-CoV-2 in India.,Choudhary ML. Vipat V. Jadhav S. Basu A. Cherian S. Abraham P. Potdar VA,2020-03-31,English,The Indian journal of medical research
COVID-19,Laboratory preparedness for SARS-CoV-2 testing in India: Harnessing a network of Virus Research & Diagnostic Laboratories.,Gupta N. Potdar V. Praharaj I. Giri S. Sapkal G. Yadav P. Choudhary ML. Dar L. Sugunan AP. Kaur H. Munivenkatappa A. Shastri J. Kaveri K. Dutta S. Malhotra B. Jain A. Nagamani K. Shantala GB. Raut S. Vegad MM. Sharma A. Choudhary A. Brijwal M. Balakrishnan A. Manjunatha J. Pathak M. Srinivasan S. Banu H. Sharma H. Jain P. Sunita P. Ambica R. Fageria B. Patel D. Rajbongshi G. Vijay N. Narayan J. Aggarwal N. Nagar A. Gangakhedkar RR. Abraham P,2020-03-31,English,The Indian journal of medical research
COVID-19,COVID-19 epidemic: disentangling the re-emerging controversy about medical facemasks from an epidemiological perspective.,Chan KH. Yuen KY,2020-03-31,English,International journal of epidemiology
COVID-19,The outbreak of COVID-19 coronavirus and its impact on global mental health.,Torales J. O'Higgins M. Castaldelli-Maia JM. Ventriglio A,2020-03-31,English,The International journal of social psychiatry
COVID-19,"Balancing Health Privacy, Health Information Exchange and Research in the Context of the COVID-19 Pandemic.",Lenert L. McSwain BY,2020-03-31,English,Journal of the American Medical Informatics Association : JAMIA
COVID-19,Images in Clinical ECT: Immediate impact of COVID-19 on ECT Practice.,Colbert SA. McCarron S. Ryan G. McLoughlin DM,2020-03-31,English,The journal of ECT
COVID-19,ECT in a time of COVID-19.,Tor PC. Phu AHH. Koh DSH. Mok YM,2020-03-31,English,The journal of ECT
COVID-19,Overview of guidance for endoscopy during the coronavirus disease 2019 (COVID-19) pandemic.,Lui RN. Wong SH. Sánchez-Luna SA. Pellino G. Bollipo S. Wong MY. Chiu PW. Sung JJ,2020-03-31,English,Journal of gastroenterology and hepatology
COVID-19,Active Surveillance for Suspected COVID-19 Cases in Inpatients with Information Technology.,Lin CY. Cheng CH. Lu PL. Shih DC. Hung CT. Lo HH. Tsai MJ. Hung JY,2020-03-31,English,The Journal of hospital infection
COVID-19,Human challenge studies to accelerate coronavirus vaccine licensure.,Eyal N. Lipsitch M. Smith PG,2020-03-31,English,The Journal of infectious diseases
COVID-19,"Analysis of heart injury laboratory parameters in 273 COVID-19 patients in one hospital in Wuhan, China.",Han H. Xie L. Liu R. Yang J. Liu F. Wu K. Chen L. Hou W. Feng Y. Zhu C,2020-03-31,English,Journal of medical virology
COVID-19,COVID-19 epidemic: disease characteristics in children.,Jiatong S. Lanqin L. Wenjun L,2020-03-31,English,Journal of medical virology
COVID-19,Potential utilities of mask wearing and instant hand hygiene for fighting SARS-CoV-2.,Ma QX. Shan H. Zhang HL. Li GM. Yang RM. Chen JM,2020-03-31,English,Journal of medical virology
COVID-19,Telemedicine in the Time of Coronavirus.,Calton B. Abedini N. Fratkin M,2020-03-31,English,Journal of pain and symptom management
COVID-19,COVID-19 and Paediatric Inflammatory Bowel Diseases: Global Experience and Provisional Guidance (March 2020) from the Paediatric IBD Porto group of ESPGHAN.,Turner D. Huang Y. Martín-de-Carpi J. Aloi M. Focht G. Kang B. Zhou Y. Sanchez C. Kappelman MD. Uhlig HH. Pujol-Muncunill G. Ledder O. Lionetti P. Dias JA. Ruemmele FM. Russell RK,2020-03-31,English,Journal of pediatric gastroenterology and nutrition
COVID-19,A Comparative Study of Chest Computed Tomography Features in Young and Older Adults With Corona Virus Disease (COVID-19).,Zhu T. Wang Y. Zhou S. Zhang N. Xia L,2020-03-31,English,Journal of thoracic imaging
COVID-19,A rapid fatal evolution of Coronavirus Disease-19 (COVID-19) in an advanced lung cancer patient with a long time response to nivolumab.,Bonomi L. Ghilardi L. Arnoldi E. Tondini CA. Bettini AC,2020-03-31,English,Journal of thoracic oncology : official publication of the International Association for the Study of Lung Cancer
COVID-19,"18 F-FDG uptake in Asymptomatic SARS-CoV-2 (COVID-19) patient, referred to PET/CT for Non-Small Cells Lung Cancer restaging.",Polverari G. Arena V. Ceci F. Pelosi E. Ianniello A. Poli E. Sandri A. Penna D,2020-03-31,English,Journal of thoracic oncology : official publication of the International Association for the Study of Lung Cancer
COVID-19,COVID-19 and the Urology Match: Perspectives and a Call to Action.,Gabrielson AT. Kohn TP. Clifton MM,2020-03-31,English,The Journal of urology
COVID-19,Medical Student Education in the Time of COVID-19.,Rose S,2020-03-31,English,JAMA
COVID-19,Community Prevalence of SARS-CoV-2 Among Patients With Influenzalike Illnesses Presenting to a Los Angeles Medical Center in March 2020.,Spellberg B. Haddix M. Lee R. Butler-Wu S. Holtom P. Yee H. Gounder P,2020-03-31,English,JAMA
COVID-19,Perspectives on Coronavirus Disease 2019 Control Measures for Ophthalmology Clinics Based on a Singapore Center Experience.,Jun ISY. Hui KKO. Songbo PZ,2020-03-31,English,JAMA ophthalmology
COVID-19,"Humans, Viruses, and the Eye-An Early Report From the COVID-19 Front Line.",Sommer A,2020-03-31,English,JAMA ophthalmology
COVID-19,"Characteristics of Ocular Findings of Patients With Coronavirus Disease 2019 (COVID-19) in Hubei Province, China.",Wu P. Duan F. Luo C. Liu Q. Qu X. Liang L. Wu K,2020-03-31,English,JAMA ophthalmology
COVID-19,Safety Recommendations for Evaluation and Surgery of the Head and Neck During the COVID-19 Pandemic.,Givi B. Schiff BA. Chinn SB. Clayburgh D. Iyer NG. Jalisi S. Moore MG. Nathan CA. Orloff LA. O'Neill JP. Parker N. Zender C. Morris LGT. Davies L,2020-03-31,English,JAMA otolaryngology-- head & neck surgery
COVID-19,Surgical Considerations for Tracheostomy During the COVID-19 Pandemic: Lessons Learned From the Severe Acute Respiratory Syndrome Outbreak.,Tay JK. Khoo ML. Loh WS,2020-03-31,English,JAMA otolaryngology-- head & neck surgery
COVID-19,Ultra-high-resolution computed tomography can demonstrate alveolar collapse in novel coronavirus (COVID-19) pneumonia.,Iwasawa T. Sato M. Yamaya T. Sato Y. Uchida Y. Kitamura H. Hagiwara E. Komatsu S. Utsunomiya D. Ogura T,2020-03-31,English,Japanese journal of radiology
COVID-19,Emergency cesarean section on severe acute respiratory syndrome coronavirus 2 (SARS- CoV-2) confirmed patient.,Lee DH. Lee J. Kim E. Woo K. Park HY. An J,2020-03-31,English,Korean journal of anesthesiology
COVID-19,Refugee and migrant health in the COVID-19 response.,Kluge HHP. Jakab Z. Bartovic J. D'Anna V. Severoni S,2020-03-31,English,"Lancet (London, England)"
COVID-19,"Medicine: before COVID-19, and after.",McCartney M,2020-03-31,English,"Lancet (London, England)"
COVID-19,Ensuring global access to COVID-19 vaccines.,Yamey G. Schäferhoff M. Hatchett R. Pate M. Zhao F. McDade KK,2020-03-31,English,"Lancet (London, England)"
COVID-19,Protecting the psychological health of children through effective communication about COVID-19.,Dalton L. Rapa E. Stein A,2020-03-31,English,The Lancet. Child & adolescent health
COVID-19,SARS-CoV-2: a time for clear and immediate action.,Poland GA,2020-03-31,English,The Lancet. Infectious diseases
COVID-19,COVID-19 and immigration detention in the USA: time to act.,Keller AS. Wagner BD,2020-03-31,English,The Lancet. Public health
COVID-19,Impacts of COVID-19 on vulnerable children in temporary accommodation in the UK.,Rosenthal DM. Ucci M. Heys M. Hayward A. Lakhanpaul M,2020-03-31,English,The Lancet. Public health
COVID-19,Stellungnahme zur Anwendung von Glukokortikosteroiden bei entzündlichen Erkrankungen der oberen Atemwege (u. a. allergische Rhinitis/chronische Rhinosinusitis) während der aktuellen COVID-19 Pandemie.,Klimek L. Förster-Ruhrmann U. Becker S. Chaker A. Huppertz T. Deitmer T. Olze H. Strieth S. Wrede H. Schlenter W. Löhler J. Wollenberg B. Beule AG. Rudack C. Bachert C. Dietz A,2020-03-31,German,Laryngo- rhino- otologie
COVID-19,C-reactive protein levels in the early stage of COVID-19.,Ling W,2020-03-31,English,Medecine et maladies infectieuses
COVID-19,Shell disorder analysis predicts greater resilience of the SARS-CoV-2 (COVID-19) outside the body and in body fluids.,Goh GK. Dunker AK. Foster JA. Uversky VN,2020-03-31,English,Microbial pathogenesis
COVID-19,Recommendations of management in SARS-CoV-2 infection of the Polish Association of Epidemiologists and Infectiologists.,Flisiak R. Horban A. Jaroszewicz J. Kozielewicz D. Pawłowska M. Parczewski M. Piekarska A. Tomasiewicz K. Zarębska-Michaluk D,2020-03-31,English,Polish archives of internal medicine
COVID-19,Hypertension and its severity or mortality in Coronavirus Disease 2019 (COVID-19): a pooled analysis.,Lippi G. Wong J. Henry BM,2020-03-31,English,Polish archives of internal medicine
COVID-19,63-year-old male treated for COVID-19.,Sabri A. Taheri MS. Mahdavi A. Dobranowski J,2020-03-31,English,Polish archives of internal medicine
COVID-19,3D CT of Novel Coronavirus (COVID-19) Pneumonia.,Ufuk F,2020-03-31,English,Radiology
COVID-19,On the frontline against COVID-19: Community pharmacists' contribution during a public health crisis.,Cadogan CA. Hughes CM,2020-03-31,English,Research in social & administrative pharmacy : RSAP
COVID-19,"The brain, another potential target organ, needs early protection from SARS-CoV-2 neuroinvasion.",Li Z. Huang Y. Guo X,2020-03-31,English,Science China. Life sciences
COVID-19,Quantifying SARS-CoV-2 transmission suggests epidemic control with digital contact tracing.,Ferretti L. Wymant C. Kendall M. Zhao L. Nurtay A. Abeler-Dörner L. Parker M. Bonsall D. Fraser C,2020-03-31,English,"Science (New York, N.Y.)"
COVID-19,An investigation of transmission control measures during the first 50 days of the COVID-19 epidemic in China.,Tian H. Liu Y. Li Y. Wu CH. Chen B. Kraemer MUG. Li B. Cai J. Xu B. Yang Q. Wang B. Yang P. Cui Y. Song Y. Zheng P. Wang Q. Bjornstad ON. Yang R. Grenfell BT. Pybus OG. Dye C,2020-03-31,English,"Science (New York, N.Y.)"
COVID-19,At the ‘heart’ of the COVID-19 outbreak: early cardiac implications and mitigating strategies.,Cherian R. Poh KK,2020-03-31,English,Singapore medical journal
COVID-19,Dealing with COVID-19: initial perspectives of a small radiology department.,Kok SSX. Mohamed Shah MTB. Cheong WK. Cheng AKC. Sng LH. Salkade PR. Wong SBS,2020-03-31,English,Singapore medical journal
COVID-19,ISUOG Consensus Statement on organization of routine and specialist obstetric ultrasound services in the context of COVID-19.,Abu-Rustum RS. Akolekar R. Sotiriadis A. Salomon LJ. Da Silva Costa F. Wu Q. Frusca T. Bilardo CM. Prefumo F. Poon LC,2020-03-31,English,Ultrasound in obstetrics & gynecology : the official journal of the International Society of Ultrasound in Obstetrics and Gynecology
COVID-19,[Geriatrics in times of corona].,Gosch M. Singler K. Kwetkat A. Heppner HJ,2020-03-31,German,Zeitschrift fur Gerontologie und Geriatrie
COVID-19,SARS-CoV-2 (COVID-19) by the numbers.,Bar-On YM. Flamholz A. Phillips R. Milo R,2020-03-31,English,ELife
COVID-19,People with Suspected COVID-19 Symptoms Were More Likely Depressed and Had Lower Health-Related Quality of Life: The Potential Benefit of Health Literacy.,Nguyen HC. Nguyen MH. Do BN. Tran CQ. Nguyen TTP. Pham KM. Pham LV. Tran KV. Duong TT. Tran TV. Duong TH. Nguyen TT. Nguyen QH. Hoang TM. Nguyen KT. Pham TTM. Yang SH. Chao JC. Duong TV,2020-03-31,English,Journal of clinical medicine
COVID-19,A Systematic Review of COVID-19 Epidemiology Based on Current Evidence.,Park M. Cook AR. Lim JT. Sun Y. Dickens BL,2020-03-31,English,Journal of clinical medicine
COVID-19,"Geroprotective and senoremediative strategies to reduce the comorbidity, infection rates, severity, and lethality in gerophilic and gerolavic infections.",Zhavoronkov A,2020-03-31,English,Aging
COVID-19,Global outbreak of COVID-19: a new challenge?,Musa TH. Ahmad T. Khan M. Haroon H. Wei P,2020-03-31,English,Journal of infection in developing countries
COVID-19,Spatial-temporal distribution of COVID-19 in China and its prediction: A data-driven modeling analysis.,Huang R. Liu M. Ding Y,2020-03-31,English,Journal of infection in developing countries
COVID-19,The novel zoonotic COVID-19 pandemic: An expected global health concern.,Contini C. Di Nuzzo M. Barp N. Bonazza A. De Giorgio R. Tognon M. Rubino S,2020-03-31,English,Journal of infection in developing countries
COVID-19,"As COVID-19 cases, deaths and fatality rates surge in Italy, underlying causes require investigation.",Rubino S. Kelvin N. Bermejo-Martin JF. Kelvin D,2020-03-31,English,Journal of infection in developing countries
COVID-19,"Data-based analysis, modelling and forecasting of the COVID-19 outbreak.",Anastassopoulou C. Russo L. Tsakris A. Siettos C,2020-03-31,English,PloS one
COVID-19,Forecasting the novel coronavirus COVID-19.,Petropoulos F. Makridakis S,2020-03-31,English,PloS one
COVID-19,Prediction of Number of Cases of 2019 Novel Coronavirus (COVID-19) Using Social Media Search Index.,Qin L. Sun Q. Wang Y. Wu KF. Chen M. Shia BC. Wu SY,2020-03-31,English,International journal of environmental research and public health
COVID-19,"Impact of the COVID-19 Pandemic on Mental Health and Quality of Life among Local Residents in Liaoning Province, China: A Cross-Sectional Study.",Zhang Y. Ma ZF,2020-03-31,English,International journal of environmental research and public health
COVID-19,"Asymptomatic and Human-to-Human Transmission of SARS-CoV-2 in a 2-Family Cluster, Xuzhou, China.",Li C. Ji F. Wang L. Wang L. Hao J. Dai M. Liu Y. Pan X. Fu J. Li L. Yang G. Yang J. Yan X. Gu B,2020-03-31,English,Emerging infectious diseases
COVID-19,"Policy Decisions and Use of Information Technology to Fight 2019 Novel Coronavirus Disease, Taiwan.",Lin C. Braund WE. Auerbach J. Chou JH. Teng JH. Tu P. Mullen J,2020-03-31,English,Emerging infectious diseases
COVID-19,Primary care management of the coronavirus (COVID-19).,Mash B,2020-03-31,English,South African family practice : official journal of the South African Academy of Family Practice/Primary Care
COVID-19,Coinfección entre dengue y COVID-19: Necesidad de abordaje en zonas endémicas.,Saavedra-Velasco M. Chiara-Chilet C. Pichardo-Rodriguez R. Grandez-Urbina A. Inga-Berrospi F,2020-03-31,Spanish; Castilian,"Revista de la Facultad de Ciencias Medicas (Cordoba, Argentina)"
COVID-19,Con alerta pero sin pánico. El rol de los medios durante la pandemia.,Segura MS,2020-03-31,Spanish; Castilian,"Revista de la Facultad de Ciencias Medicas (Cordoba, Argentina)"
COVID-19,A Viewpoint From Paris on the COVID-19 Pandemic: A Necessary Turn to Telepsychiatry.,Corruble E,2020-03-31,English,The Journal of clinical psychiatry
COVID-19,COVID-19 Diary From a Psychiatry Department in Italy.,Fagiolini A. Cuomo A. Frank E,2020-03-31,English,The Journal of clinical psychiatry
COVID-19,Chloroquine in COVID-19: the evidence.,Gupta N. Agrawal S. Ish P,2020-03-31,English,Monaldi archives for chest disease = Archivio Monaldi per le malattie del torace
COVID-19,Enhanced isolation of SARS-CoV-2 by TMPRSS2-expressing cells.,Matsuyama S. Nao N. Shirato K. Kawase M. Saito S. Takayama I. Nagata N. Sekizuka T. Katoh H. Kato F. Sakata M. Tahara M. Kutsuna S. Ohmagari N. Kuroda M. Suzuki T. Kageyama T. Takeda M,2020-03-31,English,Proceedings of the National Academy of Sciences of the United States of America
COVID-19,Impact of international travel and border control measures on the global spread of the novel 2019 coronavirus outbreak.,Wells CR. Sah P. Moghadas SM. Pandey A. Shoukat A. Wang Y. Wang Z. Meyers LA. Singer BH. Galvani AP,2020-03-31,English,Proceedings of the National Academy of Sciences of the United States of America
COVID-19,WHO must prioritise the needs of older people in its response to the covid-19 pandemic.,,2020-03-31,English,BMJ (Clinical research ed.)
COVID-19,Clinical characteristics of 113 deceased patients with coronavirus disease 2019: retrospective study.,,2020-03-31,English,BMJ (Clinical research ed.)
COVID-19,"Covid-19: Doctors still at ""considerable risk"" from lack of PPE, BMA warns.",Iacobucci G,2020-03-31,English,BMJ (Clinical research ed.)
COVID-19,Covid-19: healthcare staff in hotspot areas are prioritised as testing expands.,Iacobucci G,2020-03-31,English,BMJ (Clinical research ed.)
COVID-19,How to risk-stratify elective surgery during the COVID-19 pandemic?,"Stahel, Philip F.",2020-03-31,English,Patient Safety in Surgery
COVID-19,Enhanced isolation of SARS-CoV-2 by TMPRSS2-expressing cells.,Shutoku Matsuyama. Naganori Nao. Kazuya Shirato. Miyuki Kawase. Shinji Saito. Ikuyo Takayama. Noriyo Nagata. Tsuyoshi Sekizuka. Hiroshi Katoh. Fumihiro Kato. Masafumi Sakata. Maino Tahara. Satoshi Kutsuna. Norio Ohmagari. Makoto Kuroda. Tadaki Suzuki. Tsutomu Kageyama. Makoto Takeda,2020-03-31,English,Proceedings of the National Academy of Sciences of the United States of America
COVID-19,Impact of COVID-19 containment efforts.,B. D.,2020-03-31,English,Proceedings of the National Academy of Sciences of the United States of America
COVID-19,Quarantined.,Lee M,2020-04-01,English,Academic emergency medicine : official journal of the Society for Academic Emergency Medicine
COVID-19,Letter to the Editor.,Toljan K,2020-04-01,English,ACS chemical neuroscience
COVID-19,Case Report: Walking Pneumonia in Novel Coronavirus Disease (COVID-19): Mild Symptoms with Marked Abnormalities on Chest Imaging.,Sivakorn C. Luvira V. Muangnoicharoen S. Piroonamornpun P. Ouppapong T. Mungaomklang A. Iamsirithaworn S,2020-04-01,English,The American journal of tropical medicine and hygiene
COVID-19,The COVID-19 Pandemic: Effects on Low and Middle-Income Countries.,Bong CL. Brasher C. Chikumba E. McDougall R. Mellin-Olsen J. Enright A,2020-04-01,English,Anesthesia and analgesia
COVID-19,The COVID-19: Role of Ambulatory Surgery Facilities in This Global Pandemic.,Rajan N. Joshi GP,2020-04-01,English,Anesthesia and analgesia
COVID-19,Environment and Personal Protective Equipment Tests for SARS-CoV-2 in the Isolation Room of an Infant With Infection.,Yung CF. Kam KQ. Wong MSY. Maiwald M. Tan YK. Tan BH. Thoon KC,2020-04-01,English,Annals of internal medicine
COVID-19,Potential covalent drugs targeting the main protease of the SARS-CoV-2 coronavirus.,Liu S. Zheng Q. Wang Z,2020-04-01,English,"Bioinformatics (Oxford, England)"
COVID-19,"Mobile field hospitals, an effective way of dealing with COVID-19 in China: sharing our experience.",Chen Z. He S. Li F. Yin J. Chen X,2020-04-01,English,Bioscience trends
